[
  {
    "id": "018f7d2d-bc00-7cc8-8ad2-f147d6a2e710",
    "uri": "https://fixtures.fortemi.dev/collections/portable",
    "pref_label": "Portable concepts",
    "definition": "Concepts used by the full-v1 candidate corpus.",
    "is_ordered": true,
    "scheme_id": "018f7d2d-bc00-7cc8-8ad2-f147d6a2e701",
    "created_at": "2026-07-18T16:00:00Z",
    "updated_at": "2026-07-18T16:00:00Z"
  }
]
